{
  "schema_version": "asb-sec-0.1",
  "event_id": "evt-agent-allow-001",
  "timestamp": "2025-01-01T12:00:03Z",
  "tenant_id": "tenant-a",
  "app_id": "support-agent",
  "env": "prod",
  "subject": {
    "user": {
      "id": "alice",
      "type": "human",
      "roles": ["support_engineer"],
      "groups": ["team-a"],
      "attributes": {
        "department": "support",
        "region": "EU"
      }
    },
    "agent": {
      "id": "support-bot",
      "type": "llm_agent",
      "version": "v1.2.0"
    },
    "client": {
      "ip": "203.0.113.1",
      "user_agent": "autogen/0.4",
      "channel": "api"
    }
  },
  "operation": {
    "category": "agent_tool",
    "name": "update_ticket",
    "direction": "input",
    "request_id": "req-abc-125",
    "stage": "pre"
  },
  "resource": {
    "agent_tool": {
      "tool_name": "update_ticket",
      "tool_category": "ticketing",
      "target_system": "jira",
      "args": {
        "id": "T-2024-001",
        "status": "in_progress",
        "priority": "high"
      }
    }
  },
  "context": {
    "trace_id": "trace-xyz-003",
    "span_id": "span-004",
    "labels": {
      "source": "autogen",
      "workflow": "support-triage",
      "region": "eu-central-1"
    }
  },
  "decision": {
    "effect": "allow",
    "applied_policies": [
      "agent.allow_support_update_ticket"
    ],
    "actions": [
      "log_event"
    ],
    "risk_level": "low",
    "reason": "Support engineer allowed to update high-priority ticket without resolving it."
  }
}
